movie_id,title,genre,overview,search_text
514,Children of Men,"Adventure, Drama, Sci-Fi","In 2027, in a chaotic world in which women have become somehow infertile, a former activist agrees to help transport a miraculously pregnant woman to a sanctuary at sea.","Title: Children of Men. Genres: Adventure, Drama, Sci-Fi. Overview: In 2027, in a chaotic world in which women have become somehow infertile, a former activist agrees to help transport a miraculously pregnant woman to a sanctuary at sea."
515,Almost Famous,"Adventure, Comedy, Drama",A high-school boy is given the chance to write a story for Rolling Stone Magazine about an up-and-coming rock band as he accompanies them on their concert tour.,"Title: Almost Famous. Genres: Adventure, Comedy, Drama. Overview: A high-school boy is given the chance to write a story for Rolling Stone Magazine about an up-and-coming rock band as he accompanies them on their concert tour."
516,Mulholland Dr.,"Drama, Mystery, Thriller","After a car wreck on the winding Mulholland Drive renders a woman amnesiac, she and a perky Hollywood-hopeful search for clues and answers across Los Angeles in a twisting venture beyond dreams and reality.","Title: Mulholland Dr.. Genres: Drama, Mystery, Thriller. Overview: After a car wreck on the winding Mulholland Drive renders a woman amnesiac, she and a perky Hollywood-hopeful search for clues and answers across Los Angeles in a twisting venture beyond dreams and reality."
517,Toy Story 2,"Animation, Adventure, Comedy","When Woody is stolen by a toy collector, Buzz and his friends set out on a rescue mission to save Woody before he becomes a museum toy property with his roundup gang Jessie, Prospector, and Bullseye.","Title: Toy Story 2. Genres: Animation, Adventure, Comedy. Overview: When Woody is stolen by a toy collector, Buzz and his friends set out on a rescue mission to save Woody before he becomes a museum toy property with his roundup gang Jessie, Prospector, and Bullseye."
518,Boogie Nights,Drama,"Back when sex was safe, pleasure was a business and business was booming, an idealistic porn producer aspires to elevate his craft to an art when he discovers a hot young talent.","Title: Boogie Nights. Genres: Drama. Overview: Back when sex was safe, pleasure was a business and business was booming, an idealistic porn producer aspires to elevate his craft to an art when he discovers a hot young talent."
519,Mimi wo sumaseba,"Animation, Drama, Family","A love story between a girl who loves reading books, and a boy who has previously checked out all of the library books she chooses.","Title: Mimi wo sumaseba. Genres: Animation, Drama, Family. Overview: A love story between a girl who loves reading books, and a boy who has previously checked out all of the library books she chooses."
520,Once Were Warriors,"Crime, Drama",A family descended from Maori warriors is bedeviled by a violent father and the societal problems of being treated as outcasts.,"Title: Once Were Warriors. Genres: Crime, Drama. Overview: A family descended from Maori warriors is bedeviled by a violent father and the societal problems of being treated as outcasts."
521,True Romance,"Crime, Drama, Romance","In Detroit, a lonely pop culture geek marries a call girl, steals cocaine from her pimp, and tries to sell it in Hollywood. Meanwhile, the owners of the cocaine, the Mob, track them down in an attempt to reclaim it.","Title: True Romance. Genres: Crime, Drama, Romance. Overview: In Detroit, a lonely pop culture geek marries a call girl, steals cocaine from her pimp, and tries to sell it in Hollywood. Meanwhile, the owners of the cocaine, the Mob, track them down in an attempt to reclaim it."
522,Trois couleurs: Bleu,"Drama, Music, Mystery",A woman struggles to find a way to live her life after the death of her husband and child.,"Title: Trois couleurs: Bleu. Genres: Drama, Music, Mystery. Overview: A woman struggles to find a way to live her life after the death of her husband and child."
523,Jûbê ninpûchô,"Animation, Action, Adventure",A vagabond swordsman is aided by a beautiful ninja girl and a crafty spy in confronting a demonic clan of killers - with a ghost from his past as their leader - who are bent on overthrowing the Tokugawa Shogunate.,"Title: Jûbê ninpûchô. Genres: Animation, Action, Adventure. Overview: A vagabond swordsman is aided by a beautiful ninja girl and a crafty spy in confronting a demonic clan of killers - with a ghost from his past as their leader - who are bent on overthrowing the Tokugawa Shogunate."
524,Carlito's Way,"Crime, Drama, Thriller","A Puerto Rican former convict, just released from prison, pledges to stay away from drugs and violence despite the pressure around him and lead on to a better life outside of N.Y.C.","Title: Carlito's Way. Genres: Crime, Drama, Thriller. Overview: A Puerto Rican former convict, just released from prison, pledges to stay away from drugs and violence despite the pressure around him and lead on to a better life outside of N.Y.C."
525,Edward Scissorhands,"Drama, Fantasy, Romance","An artificial man, who was incompletely constructed and has scissors for hands, leads a solitary life. Then one day, a suburban lady meets him and introduces him to her world.","Title: Edward Scissorhands. Genres: Drama, Fantasy, Romance. Overview: An artificial man, who was incompletely constructed and has scissors for hands, leads a solitary life. Then one day, a suburban lady meets him and introduces him to her world."
526,My Left Foot: The Story of Christy Brown,"Biography, Drama","Christy Brown, born with cerebral palsy, learns to paint and write with his only controllable limb - his left foot.","Title: My Left Foot: The Story of Christy Brown. Genres: Biography, Drama. Overview: Christy Brown, born with cerebral palsy, learns to paint and write with his only controllable limb - his left foot."
527,Crimes and Misdemeanors,"Comedy, Drama",An ophthalmologist's mistress threatens to reveal their affair to his wife while a married documentary filmmaker is infatuated with another woman.,"Title: Crimes and Misdemeanors. Genres: Comedy, Drama. Overview: An ophthalmologist's mistress threatens to reveal their affair to his wife while a married documentary filmmaker is infatuated with another woman."
528,The Untouchables,"Crime, Drama, Thriller","During the era of Prohibition in the United States, Federal Agent Eliot Ness sets out to stop ruthless Chicago gangster Al Capone and, because of rampant corruption, assembles a small, hand-picked team to help him.","Title: The Untouchables. Genres: Crime, Drama, Thriller. Overview: During the era of Prohibition in the United States, Federal Agent Eliot Ness sets out to stop ruthless Chicago gangster Al Capone and, because of rampant corruption, assembles a small, hand-picked team to help him."
529,Hannah and Her Sisters,"Comedy, Drama","Between two Thanksgivings two years apart, Hannah's husband falls in love with her sister Lee, while her hypochondriac ex-husband rekindles his relationship with her sister Holly.","Title: Hannah and Her Sisters. Genres: Comedy, Drama. Overview: Between two Thanksgivings two years apart, Hannah's husband falls in love with her sister Lee, while her hypochondriac ex-husband rekindles his relationship with her sister Holly."
530,Brazil,"Drama, Sci-Fi",A bureaucrat in a dystopic society becomes an enemy of the state as he pursues the woman of his dreams.,"Title: Brazil. Genres: Drama, Sci-Fi. Overview: A bureaucrat in a dystopic society becomes an enemy of the state as he pursues the woman of his dreams."
531,This Is Spinal Tap,"Comedy, Music","Spinal Tap, one of England's loudest bands, is chronicled by film director Marty DiBergi on what proves to be a fateful tour.","Title: This Is Spinal Tap. Genres: Comedy, Music. Overview: Spinal Tap, one of England's loudest bands, is chronicled by film director Marty DiBergi on what proves to be a fateful tour."
532,A Christmas Story,"Comedy, Family","In the 1940s, a young boy named Ralphie attempts to convince his parents, his teacher and Santa that a Red Ryder BB gun really is the perfect Christmas gift.","Title: A Christmas Story. Genres: Comedy, Family. Overview: In the 1940s, a young boy named Ralphie attempts to convince his parents, his teacher and Santa that a Red Ryder BB gun really is the perfect Christmas gift."
533,The Blues Brothers,"Action, Adventure, Comedy","Jake Blues, just released from prison, puts together his old band to save the Catholic home where he and his brother Elwood were raised.","Title: The Blues Brothers. Genres: Action, Adventure, Comedy. Overview: Jake Blues, just released from prison, puts together his old band to save the Catholic home where he and his brother Elwood were raised."
534,Manhattan,"Comedy, Drama, Romance",The life of a divorced television writer dating a teenage girl is further complicated when he falls in love with his best friend's mistress.,"Title: Manhattan. Genres: Comedy, Drama, Romance. Overview: The life of a divorced television writer dating a teenage girl is further complicated when he falls in love with his best friend's mistress."
535,All That Jazz,"Drama, Music, Musical","Director/choreographer Bob Fosse tells his own life story as he details the sordid career of Joe Gideon, a womanizing, drug-using dancer.","Title: All That Jazz. Genres: Drama, Music, Musical. Overview: Director/choreographer Bob Fosse tells his own life story as he details the sordid career of Joe Gideon, a womanizing, drug-using dancer."
536,Dawn of the Dead,"Action, Adventure, Horror","Following an ever-growing epidemic of zombies that have risen from the dead, two Philadelphia S.W.A.T. team members, a traffic reporter, and his television executive girlfriend seek refuge in a secluded shopping mall.","Title: Dawn of the Dead. Genres: Action, Adventure, Horror. Overview: Following an ever-growing epidemic of zombies that have risen from the dead, two Philadelphia S.W.A.T. team members, a traffic reporter, and his television executive girlfriend seek refuge in a secluded shopping mall."
537,All the President's Men,"Biography, Drama, History","""The Washington Post"" reporters Bob Woodward and Carl Bernstein uncover the details of the Watergate scandal that leads to President Richard Nixon's resignation.","Title: All the President's Men. Genres: Biography, Drama, History. Overview: ""The Washington Post"" reporters Bob Woodward and Carl Bernstein uncover the details of the Watergate scandal that leads to President Richard Nixon's resignation."
538,La montaña sagrada,"Adventure, Drama, Fantasy","In a corrupt, greed-fueled world, a powerful alchemist leads a messianic character and seven materialistic figures to the Holy Mountain, where they hope to achieve enlightenment.","Title: La montaña sagrada. Genres: Adventure, Drama, Fantasy. Overview: In a corrupt, greed-fueled world, a powerful alchemist leads a messianic character and seven materialistic figures to the Holy Mountain, where they hope to achieve enlightenment."
539,Amarcord,"Comedy, Drama, Family",A series of comedic and nostalgic vignettes set in a 1930s Italian coastal town.,"Title: Amarcord. Genres: Comedy, Drama, Family. Overview: A series of comedic and nostalgic vignettes set in a 1930s Italian coastal town."
540,Le charme discret de la bourgeoisie,Comedy,"A surreal, virtually plotless series of dreams centered around six middle-class people and their consistently interrupted attempts to have a meal together.","Title: Le charme discret de la bourgeoisie. Genres: Comedy. Overview: A surreal, virtually plotless series of dreams centered around six middle-class people and their consistently interrupted attempts to have a meal together."
541,"Aguirre, der Zorn Gottes","Action, Adventure, Biography","In the 16th century, the ruthless and insane Don Lope de Aguirre leads a Spanish expedition in search of El Dorado.","Title: Aguirre, der Zorn Gottes. Genres: Action, Adventure, Biography. Overview: In the 16th century, the ruthless and insane Don Lope de Aguirre leads a Spanish expedition in search of El Dorado."
542,Harold and Maude,"Comedy, Drama, Romance","Young, rich, and obsessed with death, Harold finds himself changed forever when he meets lively septuagenarian Maude at a funeral.","Title: Harold and Maude. Genres: Comedy, Drama, Romance. Overview: Young, rich, and obsessed with death, Harold finds himself changed forever when he meets lively septuagenarian Maude at a funeral."
543,Patton,"Biography, Drama, War",The World War II phase of the career of controversial American general George S. Patton.,"Title: Patton. Genres: Biography, Drama, War. Overview: The World War II phase of the career of controversial American general George S. Patton."
544,The Wild Bunch,"Action, Adventure, Western","An aging group of outlaws look for one last big score as the ""traditional"" American West is disappearing around them.","Title: The Wild Bunch. Genres: Action, Adventure, Western. Overview: An aging group of outlaws look for one last big score as the ""traditional"" American West is disappearing around them."
545,Night of the Living Dead,"Horror, Thriller",A ragtag group of Pennsylvanians barricade themselves in an old farmhouse to remain safe from a horde of flesh-eating ghouls that are ravaging the East Coast of the United States.,"Title: Night of the Living Dead. Genres: Horror, Thriller. Overview: A ragtag group of Pennsylvanians barricade themselves in an old farmhouse to remain safe from a horde of flesh-eating ghouls that are ravaging the East Coast of the United States."
546,The Lion in Winter,"Biography, Drama, History","1183 A.D.: King Henry II's three sons all want to inherit the throne, but he won't commit to a choice. They and his wife variously plot to force him.","Title: The Lion in Winter. Genres: Biography, Drama, History. Overview: 1183 A.D.: King Henry II's three sons all want to inherit the throne, but he won't commit to a choice. They and his wife variously plot to force him."
547,In the Heat of the Night,"Crime, Drama, Mystery",A black police detective is asked to investigate a murder in a racially hostile southern town.,"Title: In the Heat of the Night. Genres: Crime, Drama, Mystery. Overview: A black police detective is asked to investigate a murder in a racially hostile southern town."
548,Charade,"Comedy, Mystery, Romance",Romance and suspense ensue in Paris as a woman is pursued by several men who want a fortune her murdered husband had stolen. Whom can she trust?,"Title: Charade. Genres: Comedy, Mystery, Romance. Overview: Romance and suspense ensue in Paris as a woman is pursued by several men who want a fortune her murdered husband had stolen. Whom can she trust?"
549,The Manchurian Candidate,"Drama, Thriller",A former prisoner of war is brainwashed as an unwitting assassin for an international Communist conspiracy.,"Title: The Manchurian Candidate. Genres: Drama, Thriller. Overview: A former prisoner of war is brainwashed as an unwitting assassin for an international Communist conspiracy."
550,Spartacus,"Adventure, Biography, Drama",The slave Spartacus leads a violent revolt against the decadent Roman Republic.,"Title: Spartacus. Genres: Adventure, Biography, Drama. Overview: The slave Spartacus leads a violent revolt against the decadent Roman Republic."
551,L'avventura,"Drama, Mystery","A woman disappears during a Mediterranean boating trip. During the search, her lover and her best friend become attracted to each other.","Title: L'avventura. Genres: Drama, Mystery. Overview: A woman disappears during a Mediterranean boating trip. During the search, her lover and her best friend become attracted to each other."
552,Hiroshima mon amour,"Drama, Romance",A French actress filming an anti-war film in Hiroshima has an affair with a married Japanese architect as they share their differing perspectives on war.,"Title: Hiroshima mon amour. Genres: Drama, Romance. Overview: A French actress filming an anti-war film in Hiroshima has an affair with a married Japanese architect as they share their differing perspectives on war."
553,The Ten Commandments,"Adventure, Drama","Moses, an Egyptian Prince, learns of his true heritage as a Hebrew and his divine mission as the deliverer of his people.","Title: The Ten Commandments. Genres: Adventure, Drama. Overview: Moses, an Egyptian Prince, learns of his true heritage as a Hebrew and his divine mission as the deliverer of his people."
554,The Searchers,"Adventure, Drama, Western",An American Civil War veteran embarks on a journey to rescue his niece from the Comanches.,"Title: The Searchers. Genres: Adventure, Drama, Western. Overview: An American Civil War veteran embarks on a journey to rescue his niece from the Comanches."
555,East of Eden,Drama,"Two brothers struggle to maintain their strict, Bible-toting father's favor.","Title: East of Eden. Genres: Drama. Overview: Two brothers struggle to maintain their strict, Bible-toting father's favor."
556,High Noon,"Drama, Thriller, Western","A town Marshal, despite the disagreements of his newlywed bride and the townspeople around him, must face a gang of deadly killers alone at high noon when the gang leader, an outlaw he sent up years ago, arrives on the noon train.","Title: High Noon. Genres: Drama, Thriller, Western. Overview: A town Marshal, despite the disagreements of his newlywed bride and the townspeople around him, must face a gang of deadly killers alone at high noon when the gang leader, an outlaw he sent up years ago, arrives on the noon train."
557,Strangers on a Train,"Crime, Film-Noir, Thriller",A psychopath forces a tennis star to comply with his theory that two strangers can get away with murder.,"Title: Strangers on a Train. Genres: Crime, Film-Noir, Thriller. Overview: A psychopath forces a tennis star to comply with his theory that two strangers can get away with murder."
558,Harvey,"Comedy, Drama, Fantasy","Due to his insistence that he has an invisible six foot-tall rabbit for a best friend, a whimsical middle-aged man is thought by his family to be insane - but he may be wiser than anyone knows.","Title: Harvey. Genres: Comedy, Drama, Fantasy. Overview: Due to his insistence that he has an invisible six foot-tall rabbit for a best friend, a whimsical middle-aged man is thought by his family to be insane - but he may be wiser than anyone knows."
559,Miracle on 34th Street,"Comedy, Drama, Family","When a nice old man who claims to be Santa Claus is institutionalized as insane, a young lawyer decides to defend him by arguing in court that he is the real thing.","Title: Miracle on 34th Street. Genres: Comedy, Drama, Family. Overview: When a nice old man who claims to be Santa Claus is institutionalized as insane, a young lawyer decides to defend him by arguing in court that he is the real thing."
560,Notorious,"Drama, Film-Noir, Romance",A woman is asked to spy on a group of Nazi friends in South America. How far will she have to go to ingratiate herself with them?,"Title: Notorious. Genres: Drama, Film-Noir, Romance. Overview: A woman is asked to spy on a group of Nazi friends in South America. How far will she have to go to ingratiate herself with them?"
561,The Big Sleep,"Crime, Film-Noir, Mystery","Private detective Philip Marlowe is hired by a wealthy family. Before the complex case is over, he's seen murder, blackmail, and what might be love.","Title: The Big Sleep. Genres: Crime, Film-Noir, Mystery. Overview: Private detective Philip Marlowe is hired by a wealthy family. Before the complex case is over, he's seen murder, blackmail, and what might be love."
562,The Lost Weekend,"Drama, Film-Noir",The desperate life of a chronic alcoholic is followed through a four-day drinking bout.,"Title: The Lost Weekend. Genres: Drama, Film-Noir. Overview: The desperate life of a chronic alcoholic is followed through a four-day drinking bout."
563,The Philadelphia Story,"Comedy, Romance","When a rich woman's ex-husband and a tabloid-type reporter turn up just before her planned remarriage, she begins to learn the truth about herself.","Title: The Philadelphia Story. Genres: Comedy, Romance. Overview: When a rich woman's ex-husband and a tabloid-type reporter turn up just before her planned remarriage, she begins to learn the truth about herself."
564,His Girl Friday,"Comedy, Drama, Romance",A newspaper editor uses every trick in the book to keep his ace reporter ex-wife from remarrying.,"Title: His Girl Friday. Genres: Comedy, Drama, Romance. Overview: A newspaper editor uses every trick in the book to keep his ace reporter ex-wife from remarrying."
565,The Adventures of Robin Hood,"Action, Adventure, Romance","When Prince John and the Norman Lords begin oppressing the Saxon masses in King Richard's absence, a Saxon lord fights back as the outlaw leader of a rebel guerrilla army.","Title: The Adventures of Robin Hood. Genres: Action, Adventure, Romance. Overview: When Prince John and the Norman Lords begin oppressing the Saxon masses in King Richard's absence, a Saxon lord fights back as the outlaw leader of a rebel guerrilla army."
566,A Night at the Opera,"Comedy, Music, Musical",A sly business manager and two wacky friends of two opera singers help them achieve success while humiliating their stuffy and snobbish enemies.,"Title: A Night at the Opera. Genres: Comedy, Music, Musical. Overview: A sly business manager and two wacky friends of two opera singers help them achieve success while humiliating their stuffy and snobbish enemies."
567,King Kong,"Adventure, Horror, Sci-Fi",A film crew goes to a tropical island for an exotic location shoot and discovers a colossal ape who takes a shine to their female blonde star. He is then captured and brought back to New York City for public exhibition.,"Title: King Kong. Genres: Adventure, Horror, Sci-Fi. Overview: A film crew goes to a tropical island for an exotic location shoot and discovers a colossal ape who takes a shine to their female blonde star. He is then captured and brought back to New York City for public exhibition."
568,Freaks,"Drama, Horror","A circus' beautiful trapeze artist agrees to marry the leader of side-show performers, but his deformed friends discover she is only marrying him for his inheritance.","Title: Freaks. Genres: Drama, Horror. Overview: A circus' beautiful trapeze artist agrees to marry the leader of side-show performers, but his deformed friends discover she is only marrying him for his inheritance."
569,Nosferatu,"Fantasy, Horror",Vampire Count Orlok expresses interest in a new residence and real estate agent Hutter's wife.,"Title: Nosferatu. Genres: Fantasy, Horror. Overview: Vampire Count Orlok expresses interest in a new residence and real estate agent Hutter's wife."
570,The Gentlemen,"Action, Comedy, Crime","An American expat tries to sell off his highly profitable marijuana empire in London, triggering plots, schemes, bribery and blackmail in an attempt to steal his domain out from under him.","Title: The Gentlemen. Genres: Action, Comedy, Crime. Overview: An American expat tries to sell off his highly profitable marijuana empire in London, triggering plots, schemes, bribery and blackmail in an attempt to steal his domain out from under him."
571,Raazi,"Action, Drama, Thriller",A Kashmiri woman agrees to marry a Pakistani army officer in order to spy on Pakistan during the Indo-Pakistan War of 1971.,"Title: Raazi. Genres: Action, Drama, Thriller. Overview: A Kashmiri woman agrees to marry a Pakistani army officer in order to spy on Pakistan during the Indo-Pakistan War of 1971."
572,Sound of Metal,"Drama, Music",A heavy-metal drummer's life is thrown into freefall when he begins to lose his hearing.,"Title: Sound of Metal. Genres: Drama, Music. Overview: A heavy-metal drummer's life is thrown into freefall when he begins to lose his hearing."
573,Forushande,Drama,"While both participating in a production of ""Death of a Salesman,"" a teacher's wife is assaulted in her new home, which leaves him determined to find the perpetrator over his wife's traumatized objections.","Title: Forushande. Genres: Drama. Overview: While both participating in a production of ""Death of a Salesman,"" a teacher's wife is assaulted in her new home, which leaves him determined to find the perpetrator over his wife's traumatized objections."
574,Dunkirk,"Action, Drama, History","Allied soldiers from Belgium, the British Empire, and France are surrounded by the German Army and evacuated during a fierce battle in World War II.","Title: Dunkirk. Genres: Action, Drama, History. Overview: Allied soldiers from Belgium, the British Empire, and France are surrounded by the German Army and evacuated during a fierce battle in World War II."
575,Perfetti sconosciuti,"Comedy, Drama","Seven long-time friends get together for a dinner. When they decide to share with each other the content of every text message, email and phone call they receive, many secrets start to unveil and the equilibrium trembles.","Title: Perfetti sconosciuti. Genres: Comedy, Drama. Overview: Seven long-time friends get together for a dinner. When they decide to share with each other the content of every text message, email and phone call they receive, many secrets start to unveil and the equilibrium trembles."
576,Hidden Figures,"Biography, Drama, History",The story of a team of female African-American mathematicians who served a vital role in NASA during the early years of the U.S. space program.,"Title: Hidden Figures. Genres: Biography, Drama, History. Overview: The story of a team of female African-American mathematicians who served a vital role in NASA during the early years of the U.S. space program."
