movie_id,title,genre,overview,search_text
253,The Big Lebowski,"Comedy, Crime, Sport","Jeff ""The Dude"" Lebowski, mistaken for a millionaire of the same name, seeks restitution for his ruined rug and enlists his bowling buddies to help get it.","Title: The Big Lebowski. Genres: Comedy, Crime, Sport. Overview: Jeff ""The Dude"" Lebowski, mistaken for a millionaire of the same name, seeks restitution for his ruined rug and enlists his bowling buddies to help get it."
254,Fa yeung nin wah,"Drama, Romance","Two neighbors, a woman and a man, form a strong bond after both suspect extramarital activities of their spouses. However, they agree to keep their bond platonic so as not to commit similar wrongs.","Title: Fa yeung nin wah. Genres: Drama, Romance. Overview: Two neighbors, a woman and a man, form a strong bond after both suspect extramarital activities of their spouses. However, they agree to keep their bond platonic so as not to commit similar wrongs."
255,Trainspotting,Drama,"Renton, deeply immersed in the Edinburgh drug scene, tries to clean up and get out, despite the allure of the drugs and influence of friends.","Title: Trainspotting. Genres: Drama. Overview: Renton, deeply immersed in the Edinburgh drug scene, tries to clean up and get out, despite the allure of the drugs and influence of friends."
256,Fargo,"Crime, Drama, Thriller",Jerry Lundegaard's inept crime falls apart due to his and his henchmen's bungling and the persistent police work of the quite pregnant Marge Gunderson.,"Title: Fargo. Genres: Crime, Drama, Thriller. Overview: Jerry Lundegaard's inept crime falls apart due to his and his henchmen's bungling and the persistent police work of the quite pregnant Marge Gunderson."
257,Underground,"Comedy, Drama, War","A group of Serbian socialists prepares for the war in a surreal underground filled by parties, tragedies, love and hate.","Title: Underground. Genres: Comedy, Drama, War. Overview: A group of Serbian socialists prepares for the war in a surreal underground filled by parties, tragedies, love and hate."
258,La haine,"Crime, Drama",24 hours in the lives of three young men in the French suburbs the day after a violent riot.,"Title: La haine. Genres: Crime, Drama. Overview: 24 hours in the lives of three young men in the French suburbs the day after a violent riot."
259,Dilwale Dulhania Le Jayenge,"Drama, Romance","When Raj meets Simran in Europe, it isn't love at first sight but when Simran moves to India for an arranged marriage, love makes its presence felt.","Title: Dilwale Dulhania Le Jayenge. Genres: Drama, Romance. Overview: When Raj meets Simran in Europe, it isn't love at first sight but when Simran moves to India for an arranged marriage, love makes its presence felt."
260,Before Sunrise,"Drama, Romance","A young man and woman meet on a train in Europe, and wind up spending one evening together in Vienna. Unfortunately, both know that this will probably be their only night together.","Title: Before Sunrise. Genres: Drama, Romance. Overview: A young man and woman meet on a train in Europe, and wind up spending one evening together in Vienna. Unfortunately, both know that this will probably be their only night together."
261,Trois couleurs: Rouge,"Drama, Mystery, Romance",A model discovers a retired judge is keen on invading people's privacy.,"Title: Trois couleurs: Rouge. Genres: Drama, Mystery, Romance. Overview: A model discovers a retired judge is keen on invading people's privacy."
262,Chung Hing sam lam,"Comedy, Crime, Drama","Two melancholy Hong Kong policemen fall in love: one with a mysterious female underworld figure, the other with a beautiful and ethereal server at a late-night restaurant he frequents.","Title: Chung Hing sam lam. Genres: Comedy, Crime, Drama. Overview: Two melancholy Hong Kong policemen fall in love: one with a mysterious female underworld figure, the other with a beautiful and ethereal server at a late-night restaurant he frequents."
263,Jurassic Park,"Action, Adventure, Sci-Fi",A pragmatic paleontologist visiting an almost complete theme park is tasked with protecting a couple of kids after a power failure causes the park's cloned dinosaurs to run loose.,"Title: Jurassic Park. Genres: Action, Adventure, Sci-Fi. Overview: A pragmatic paleontologist visiting an almost complete theme park is tasked with protecting a couple of kids after a power failure causes the park's cloned dinosaurs to run loose."
264,In the Name of the Father,"Biography, Crime, Drama",A man's coerced confession to an I.R.A. bombing he did not commit results in the imprisonment of his father as well. An English lawyer fights to free them.,"Title: In the Name of the Father. Genres: Biography, Crime, Drama. Overview: A man's coerced confession to an I.R.A. bombing he did not commit results in the imprisonment of his father as well. An English lawyer fights to free them."
265,Ba wang bie ji,"Drama, Music, Romance",Two boys meet at an opera training school in Peking in 1924. Their resulting friendship will span nearly 70 years and will endure some of the most troublesome times in China's history.,"Title: Ba wang bie ji. Genres: Drama, Music, Romance. Overview: Two boys meet at an opera training school in Peking in 1924. Their resulting friendship will span nearly 70 years and will endure some of the most troublesome times in China's history."
266,Dà hóng denglong gaogao guà,"Drama, History, Romance","A young woman becomes the fourth wife of a wealthy lord, and must learn to live with the strict rules and tensions within the household.","Title: Dà hóng denglong gaogao guà. Genres: Drama, History, Romance. Overview: A young woman becomes the fourth wife of a wealthy lord, and must learn to live with the strict rules and tensions within the household."
267,Dead Poets Society,"Comedy, Drama",Maverick teacher John Keating uses poetry to embolden his boarding school students to new heights of self-expression.,"Title: Dead Poets Society. Genres: Comedy, Drama. Overview: Maverick teacher John Keating uses poetry to embolden his boarding school students to new heights of self-expression."
268,Stand by Me,"Adventure, Drama","After the death of one of his friends, a writer recounts a childhood journey with his friends to find the body of a missing boy.","Title: Stand by Me. Genres: Adventure, Drama. Overview: After the death of one of his friends, a writer recounts a childhood journey with his friends to find the body of a missing boy."
269,Platoon,"Drama, War","Chris Taylor, a neophyte recruit in Vietnam, finds himself caught in a battle of wills between two sergeants, one good and the other evil. A shrewd examination of the brutality of war and the duality of man in conflict.","Title: Platoon. Genres: Drama, War. Overview: Chris Taylor, a neophyte recruit in Vietnam, finds himself caught in a battle of wills between two sergeants, one good and the other evil. A shrewd examination of the brutality of war and the duality of man in conflict."
270,"Paris, Texas",Drama,"Travis Henderson, an aimless drifter who has been missing for four years, wanders out of the desert and must reconnect with society, himself, his life, and his family.","Title: Paris, Texas. Genres: Drama. Overview: Travis Henderson, an aimless drifter who has been missing for four years, wanders out of the desert and must reconnect with society, himself, his life, and his family."
271,Kaze no tani no Naushika,"Animation, Adventure, Fantasy",Warrior and pacifist Princess Nausicaä desperately struggles to prevent two warring nations from destroying themselves and their dying planet.,"Title: Kaze no tani no Naushika. Genres: Animation, Adventure, Fantasy. Overview: Warrior and pacifist Princess Nausicaä desperately struggles to prevent two warring nations from destroying themselves and their dying planet."
272,The Thing,"Horror, Mystery, Sci-Fi",A research team in Antarctica is hunted by a shape-shifting alien that assumes the appearance of its victims.,"Title: The Thing. Genres: Horror, Mystery, Sci-Fi. Overview: A research team in Antarctica is hunted by a shape-shifting alien that assumes the appearance of its victims."
273,Pink Floyd: The Wall,"Drama, Fantasy, Music",A confined but troubled rock star descends into madness in the midst of his physical and social isolation from everyone.,"Title: Pink Floyd: The Wall. Genres: Drama, Fantasy, Music. Overview: A confined but troubled rock star descends into madness in the midst of his physical and social isolation from everyone."
274,Fitzcarraldo,"Adventure, Drama","The story of Brian Sweeney Fitzgerald, an extremely determined man who intends to build an opera house in the middle of a jungle.","Title: Fitzcarraldo. Genres: Adventure, Drama. Overview: The story of Brian Sweeney Fitzgerald, an extremely determined man who intends to build an opera house in the middle of a jungle."
275,Fanny och Alexander,Drama,"Two young Swedish children experience the many comedies and tragedies of their family, the Ekdahls.","Title: Fanny och Alexander. Genres: Drama. Overview: Two young Swedish children experience the many comedies and tragedies of their family, the Ekdahls."
276,Blade Runner,"Action, Sci-Fi, Thriller","A blade runner must pursue and terminate four replicants who stole a ship in space, and have returned to Earth to find their creator.","Title: Blade Runner. Genres: Action, Sci-Fi, Thriller. Overview: A blade runner must pursue and terminate four replicants who stole a ship in space, and have returned to Earth to find their creator."
277,The Elephant Man,"Biography, Drama","A Victorian surgeon rescues a heavily disfigured man who is mistreated while scraping a living as a side-show freak. Behind his monstrous façade, there is revealed a person of kindness, intelligence and sophistication.","Title: The Elephant Man. Genres: Biography, Drama. Overview: A Victorian surgeon rescues a heavily disfigured man who is mistreated while scraping a living as a side-show freak. Behind his monstrous façade, there is revealed a person of kindness, intelligence and sophistication."
278,Life of Brian,Comedy,"Born on the original Christmas in the stable next door to Jesus Christ, Brian of Nazareth spends his life being mistaken for a messiah.","Title: Life of Brian. Genres: Comedy. Overview: Born on the original Christmas in the stable next door to Jesus Christ, Brian of Nazareth spends his life being mistaken for a messiah."
279,The Deer Hunter,"Drama, War",An in-depth examination of the ways in which the U.S. Vietnam War impacts and disrupts the lives of people in a small industrial town in Pennsylvania.,"Title: The Deer Hunter. Genres: Drama, War. Overview: An in-depth examination of the ways in which the U.S. Vietnam War impacts and disrupts the lives of people in a small industrial town in Pennsylvania."
280,Rocky,"Drama, Sport",A small-time boxer gets a supremely rare chance to fight a heavy-weight champion in a bout in which he strives to go the distance for his self-respect.,"Title: Rocky. Genres: Drama, Sport. Overview: A small-time boxer gets a supremely rare chance to fight a heavy-weight champion in a bout in which he strives to go the distance for his self-respect."
281,Network,Drama,A television network cynically exploits a deranged former anchor's ravings and revelations about the news media for its own profit.,Title: Network. Genres: Drama. Overview: A television network cynically exploits a deranged former anchor's ravings and revelations about the news media for its own profit.
282,Barry Lyndon,"Adventure, Drama, History",An Irish rogue wins the heart of a rich widow and assumes her dead husband's aristocratic position in 18th-century England.,"Title: Barry Lyndon. Genres: Adventure, Drama, History. Overview: An Irish rogue wins the heart of a rich widow and assumes her dead husband's aristocratic position in 18th-century England."
283,Zerkalo,"Biography, Drama","A dying man in his forties remembers his past. His childhood, his mother, the war, personal moments and things that tell of the recent history of all the Russian nation.","Title: Zerkalo. Genres: Biography, Drama. Overview: A dying man in his forties remembers his past. His childhood, his mother, the war, personal moments and things that tell of the recent history of all the Russian nation."
284,Chinatown,"Drama, Mystery, Thriller","A private detective hired to expose an adulterer finds himself caught up in a web of deceit, corruption, and murder.","Title: Chinatown. Genres: Drama, Mystery, Thriller. Overview: A private detective hired to expose an adulterer finds himself caught up in a web of deceit, corruption, and murder."
285,Paper Moon,"Comedy, Crime, Drama","During the Great Depression, a con man finds himself saddled with a young girl who may or may not be his daughter, and the two forge an unlikely partnership.","Title: Paper Moon. Genres: Comedy, Crime, Drama. Overview: During the Great Depression, a con man finds himself saddled with a young girl who may or may not be his daughter, and the two forge an unlikely partnership."
286,Viskningar och rop,Drama,"When a woman dying of cancer in early twentieth-century Sweden is visited by her two sisters, long-repressed feelings between the siblings rise to the surface.","Title: Viskningar och rop. Genres: Drama. Overview: When a woman dying of cancer in early twentieth-century Sweden is visited by her two sisters, long-repressed feelings between the siblings rise to the surface."
287,Solaris,"Drama, Mystery, Sci-Fi",A psychologist is sent to a station orbiting a distant planet in order to discover what has caused the crew to go insane.,"Title: Solaris. Genres: Drama, Mystery, Sci-Fi. Overview: A psychologist is sent to a station orbiting a distant planet in order to discover what has caused the crew to go insane."
288,Le samouraï,"Crime, Drama, Mystery",After professional hitman Jef Costello is seen by witnesses his efforts to provide himself an alibi drive him further into a corner.,"Title: Le samouraï. Genres: Crime, Drama, Mystery. Overview: After professional hitman Jef Costello is seen by witnesses his efforts to provide himself an alibi drive him further into a corner."
289,Cool Hand Luke,"Crime, Drama","A laid back Southern man is sentenced to two years in a rural prison, but refuses to conform.","Title: Cool Hand Luke. Genres: Crime, Drama. Overview: A laid back Southern man is sentenced to two years in a rural prison, but refuses to conform."
290,Persona,"Drama, Thriller",A nurse is put in charge of a mute actress and finds that their personae are melding together.,"Title: Persona. Genres: Drama, Thriller. Overview: A nurse is put in charge of a mute actress and finds that their personae are melding together."
291,Andrei Rublev,"Biography, Drama, History","The life, times and afflictions of the fifteenth-century Russian iconographer St. Andrei Rublev.","Title: Andrei Rublev. Genres: Biography, Drama, History. Overview: The life, times and afflictions of the fifteenth-century Russian iconographer St. Andrei Rublev."
292,La battaglia di Algeri,"Drama, War","In the 1950s, fear and violence escalate as the people of Algiers fight for independence from the French government.","Title: La battaglia di Algeri. Genres: Drama, War. Overview: In the 1950s, fear and violence escalate as the people of Algiers fight for independence from the French government."
293,El ángel exterminador,"Drama, Fantasy",The guests at an upper-class dinner party find themselves unable to leave.,"Title: El ángel exterminador. Genres: Drama, Fantasy. Overview: The guests at an upper-class dinner party find themselves unable to leave."
294,What Ever Happened to Baby Jane?,"Drama, Horror, Thriller",A former child star torments her paraplegic sister in their decaying Hollywood mansion.,"Title: What Ever Happened to Baby Jane?. Genres: Drama, Horror, Thriller. Overview: A former child star torments her paraplegic sister in their decaying Hollywood mansion."
295,Sanjuro,"Action, Comedy, Crime","A crafty samurai helps a young man and his fellow clansmen save his uncle, who has been framed and imprisoned by a corrupt superintendent.","Title: Sanjuro. Genres: Action, Comedy, Crime. Overview: A crafty samurai helps a young man and his fellow clansmen save his uncle, who has been framed and imprisoned by a corrupt superintendent."
296,The Man Who Shot Liberty Valance,"Drama, Western",A senator returns to a western town for the funeral of an old friend and tells the story of his origins.,"Title: The Man Who Shot Liberty Valance. Genres: Drama, Western. Overview: A senator returns to a western town for the funeral of an old friend and tells the story of his origins."
297,Ivanovo detstvo,"Drama, War","In WW2, twelve year old Soviet orphan Ivan Bondarev works for the Soviet army as a scout behind the German lines and strikes a friendship with three sympathetic Soviet officers.","Title: Ivanovo detstvo. Genres: Drama, War. Overview: In WW2, twelve year old Soviet orphan Ivan Bondarev works for the Soviet army as a scout behind the German lines and strikes a friendship with three sympathetic Soviet officers."
298,Jungfrukällan,Drama,"An innocent yet pampered young virgin and her family's pregnant and jealous servant set out to deliver candles to church, but only one returns from events that transpire in the woods along the way.","Title: Jungfrukällan. Genres: Drama. Overview: An innocent yet pampered young virgin and her family's pregnant and jealous servant set out to deliver candles to church, but only one returns from events that transpire in the woods along the way."
299,Inherit the Wind,"Biography, Drama, History","Based on a real-life case in 1925, two great lawyers argue the case for and against a science teacher accused of the crime of teaching evolution.","Title: Inherit the Wind. Genres: Biography, Drama, History. Overview: Based on a real-life case in 1925, two great lawyers argue the case for and against a science teacher accused of the crime of teaching evolution."
300,Les quatre cents coups,"Crime, Drama","A young boy, left without attention, delves into a life of petty crime.","Title: Les quatre cents coups. Genres: Crime, Drama. Overview: A young boy, left without attention, delves into a life of petty crime."
301,Ben-Hur,"Adventure, Drama, History","After a Jewish prince is betrayed and sent into slavery by a Roman friend, he regains his freedom and comes back for revenge.","Title: Ben-Hur. Genres: Adventure, Drama, History. Overview: After a Jewish prince is betrayed and sent into slavery by a Roman friend, he regains his freedom and comes back for revenge."
302,Kakushi-toride no san-akunin,"Adventure, Drama","Lured by gold, two greedy peasants unknowingly escort a princess and her general across enemy lines.","Title: Kakushi-toride no san-akunin. Genres: Adventure, Drama. Overview: Lured by gold, two greedy peasants unknowingly escort a princess and her general across enemy lines."
303,Le notti di Cabiria,Drama,A waifish prostitute wanders the streets of Rome looking for true love but finds only heartbreak.,Title: Le notti di Cabiria. Genres: Drama. Overview: A waifish prostitute wanders the streets of Rome looking for true love but finds only heartbreak.
304,Kumonosu-jô,"Drama, History","A war-hardened general, egged on by his ambitious wife, works to fulfill a prophecy that he would become lord of Spider's Web Castle.","Title: Kumonosu-jô. Genres: Drama, History. Overview: A war-hardened general, egged on by his ambitious wife, works to fulfill a prophecy that he would become lord of Spider's Web Castle."
305,The Bridge on the River Kwai,"Adventure, Drama, War","British POWs are forced to build a railway bridge across the river Kwai for their Japanese captors, not knowing that the allied forces are planning to destroy it.","Title: The Bridge on the River Kwai. Genres: Adventure, Drama, War. Overview: British POWs are forced to build a railway bridge across the river Kwai for their Japanese captors, not knowing that the allied forces are planning to destroy it."
306,On the Waterfront,"Crime, Drama, Thriller",An ex-prize fighter turned longshoreman struggles to stand up to his corrupt union bosses.,"Title: On the Waterfront. Genres: Crime, Drama, Thriller. Overview: An ex-prize fighter turned longshoreman struggles to stand up to his corrupt union bosses."
307,Le salaire de la peur,"Adventure, Drama, Thriller","In a decrepit South American village, four men are hired to transport an urgent nitroglycerine shipment without the equipment that would make it safe.","Title: Le salaire de la peur. Genres: Adventure, Drama, Thriller. Overview: In a decrepit South American village, four men are hired to transport an urgent nitroglycerine shipment without the equipment that would make it safe."
308,Ace in the Hole,"Drama, Film-Noir","A frustrated former big-city journalist now stuck working for an Albuquerque newspaper exploits a story about a man trapped in a cave to rekindle his career, but the situation quickly escalates into an out-of-control circus.","Title: Ace in the Hole. Genres: Drama, Film-Noir. Overview: A frustrated former big-city journalist now stuck working for an Albuquerque newspaper exploits a story about a man trapped in a cave to rekindle his career, but the situation quickly escalates into an out-of-control circus."
309,White Heat,"Action, Crime, Drama",A psychopathic criminal with a mother complex makes a daring break from prison and leads his old gang in a chemical plant payroll heist.,"Title: White Heat. Genres: Action, Crime, Drama. Overview: A psychopathic criminal with a mother complex makes a daring break from prison and leads his old gang in a chemical plant payroll heist."
310,The Third Man,"Film-Noir, Mystery, Thriller","Pulp novelist Holly Martins travels to shadowy, postwar Vienna, only to find himself investigating the mysterious death of an old friend, Harry Lime.","Title: The Third Man. Genres: Film-Noir, Mystery, Thriller. Overview: Pulp novelist Holly Martins travels to shadowy, postwar Vienna, only to find himself investigating the mysterious death of an old friend, Harry Lime."
311,The Red Shoes,"Drama, Music, Romance",A young ballet dancer is torn between the man she loves and her pursuit to become a prima ballerina.,"Title: The Red Shoes. Genres: Drama, Music, Romance. Overview: A young ballet dancer is torn between the man she loves and her pursuit to become a prima ballerina."
312,The Shop Around the Corner,"Comedy, Drama, Romance","Two employees at a gift shop can barely stand each other, without realizing that they are falling in love through the post as each other's anonymous pen pal.","Title: The Shop Around the Corner. Genres: Comedy, Drama, Romance. Overview: Two employees at a gift shop can barely stand each other, without realizing that they are falling in love through the post as each other's anonymous pen pal."
313,Rebecca,"Drama, Mystery, Romance",A self-conscious woman juggles adjusting to her new role as an aristocrat's wife and avoiding being intimidated by his first wife's spectral presence.,"Title: Rebecca. Genres: Drama, Mystery, Romance. Overview: A self-conscious woman juggles adjusting to her new role as an aristocrat's wife and avoiding being intimidated by his first wife's spectral presence."
314,Mr. Smith Goes to Washington,"Comedy, Drama","A naive man is appointed to fill a vacancy in the United States Senate. His plans promptly collide with political corruption, but he doesn't back down.","Title: Mr. Smith Goes to Washington. Genres: Comedy, Drama. Overview: A naive man is appointed to fill a vacancy in the United States Senate. His plans promptly collide with political corruption, but he doesn't back down."
315,Gone with the Wind,"Drama, History, Romance",A manipulative woman and a roguish man conduct a turbulent romance during the American Civil War and Reconstruction periods.,"Title: Gone with the Wind. Genres: Drama, History, Romance. Overview: A manipulative woman and a roguish man conduct a turbulent romance during the American Civil War and Reconstruction periods."
316,La Grande Illusion,"Drama, War","During WWI, two French soldiers are captured and imprisoned in a German P.O.W. camp. Several escape attempts follow until they are eventually sent to a seemingly inescapable fortress.","Title: La Grande Illusion. Genres: Drama, War. Overview: During WWI, two French soldiers are captured and imprisoned in a German P.O.W. camp. Several escape attempts follow until they are eventually sent to a seemingly inescapable fortress."
317,It Happened One Night,"Comedy, Romance","A renegade reporter and a crazy young heiress meet on a bus heading for New York, and end up stuck with each other when the bus leaves them behind at one of the stops.","Title: It Happened One Night. Genres: Comedy, Romance. Overview: A renegade reporter and a crazy young heiress meet on a bus heading for New York, and end up stuck with each other when the bus leaves them behind at one of the stops."
318,La passion de Jeanne d'Arc,"Biography, Drama, History","In 1431, Jeanne d'Arc is placed on trial on charges of heresy. The ecclesiastical jurists attempt to force Jeanne to recant her claims of holy visions.","Title: La passion de Jeanne d'Arc. Genres: Biography, Drama, History. Overview: In 1431, Jeanne d'Arc is placed on trial on charges of heresy. The ecclesiastical jurists attempt to force Jeanne to recant her claims of holy visions."
319,The Circus,"Comedy, Romance",The Tramp finds work and the girl of his dreams at a circus.,"Title: The Circus. Genres: Comedy, Romance. Overview: The Tramp finds work and the girl of his dreams at a circus."
