movie_id,title,genre,overview,search_text
703,Bonnie and Clyde,"Action, Biography, Crime","Bored waitress Bonnie Parker falls in love with an ex-con named Clyde Barrow and together they start a violent crime spree through the country, stealing cars and robbing banks.","Title: Bonnie and Clyde. Genres: Action, Biography, Crime. Overview: Bored waitress Bonnie Parker falls in love with an ex-con named Clyde Barrow and together they start a violent crime spree through the country, stealing cars and robbing banks."
704,My Fair Lady,"Drama, Family, Musical",Snobbish phonetics Professor Henry Higgins agrees to a wager that he can make flower girl Eliza Doolittle presentable in high society.,"Title: My Fair Lady. Genres: Drama, Family, Musical. Overview: Snobbish phonetics Professor Henry Higgins agrees to a wager that he can make flower girl Eliza Doolittle presentable in high society."
705,Mary Poppins,"Comedy, Family, Fantasy","In turn of the century London, a magical nanny employs music and adventure to help two neglected children become closer to their father.","Title: Mary Poppins. Genres: Comedy, Family, Fantasy. Overview: In turn of the century London, a magical nanny employs music and adventure to help two neglected children become closer to their father."
706,The Longest Day,"Action, Drama, History","The events of D-Day, told on a grand scale from both the Allied and German points of view.","Title: The Longest Day. Genres: Action, Drama, History. Overview: The events of D-Day, told on a grand scale from both the Allied and German points of view."
707,Jules et Jim,"Drama, Romance",Decades of a love triangle concerning two friends and an impulsive woman.,"Title: Jules et Jim. Genres: Drama, Romance. Overview: Decades of a love triangle concerning two friends and an impulsive woman."
708,The Innocents,Horror,A young governess for two children becomes convinced that the house and grounds are haunted.,Title: The Innocents. Genres: Horror. Overview: A young governess for two children becomes convinced that the house and grounds are haunted.
709,À bout de souffle,"Crime, Drama","A small-time thief steals a car and impulsively murders a motorcycle policeman. Wanted by the authorities, he reunites with a hip American journalism student and attempts to persuade her to run away with him to Italy.","Title: À bout de souffle. Genres: Crime, Drama. Overview: A small-time thief steals a car and impulsively murders a motorcycle policeman. Wanted by the authorities, he reunites with a hip American journalism student and attempts to persuade her to run away with him to Italy."
710,Red River,"Action, Adventure, Drama","Dunson leads a cattle drive, the culmination of over 14 years of work, to its destination in Missouri. But his tyrannical behavior along the way causes a mutiny, led by his adopted son.","Title: Red River. Genres: Action, Adventure, Drama. Overview: Dunson leads a cattle drive, the culmination of over 14 years of work, to its destination in Missouri. But his tyrannical behavior along the way causes a mutiny, led by his adopted son."
711,Key Largo,"Action, Crime, Drama","A man visits his war buddy's family hotel and finds a gangster running things. As a hurricane approaches, the two end up confronting each other.","Title: Key Largo. Genres: Action, Crime, Drama. Overview: A man visits his war buddy's family hotel and finds a gangster running things. As a hurricane approaches, the two end up confronting each other."
712,To Have and Have Not,"Adventure, Comedy, Film-Noir","During World War II, American expatriate Harry Morgan helps transport a French Resistance leader and his beautiful wife to Martinique while romancing a sensuous lounge singer.","Title: To Have and Have Not. Genres: Adventure, Comedy, Film-Noir. Overview: During World War II, American expatriate Harry Morgan helps transport a French Resistance leader and his beautiful wife to Martinique while romancing a sensuous lounge singer."
713,Shadow of a Doubt,"Film-Noir, Thriller","A young girl, overjoyed when her favorite uncle comes to visit the family, slowly begins to suspect that he is in fact the ""Merry Widow"" killer sought by the authorities.","Title: Shadow of a Doubt. Genres: Film-Noir, Thriller. Overview: A young girl, overjoyed when her favorite uncle comes to visit the family, slowly begins to suspect that he is in fact the ""Merry Widow"" killer sought by the authorities."
714,Stagecoach,"Adventure, Drama, Western",A group of people traveling on a stagecoach find their journey complicated by the threat of Geronimo and learn something about each other in the process.,"Title: Stagecoach. Genres: Adventure, Drama, Western. Overview: A group of people traveling on a stagecoach find their journey complicated by the threat of Geronimo and learn something about each other in the process."
715,The Lady Vanishes,"Mystery, Thriller","While travelling in continental Europe, a rich young playgirl realizes that an elderly lady seems to have disappeared from the train.","Title: The Lady Vanishes. Genres: Mystery, Thriller. Overview: While travelling in continental Europe, a rich young playgirl realizes that an elderly lady seems to have disappeared from the train."
716,Bringing Up Baby,"Comedy, Family, Romance","While trying to secure a $1 million donation for his museum, a befuddled paleontologist is pursued by a flighty and often irritating heiress and her pet leopard, Baby.","Title: Bringing Up Baby. Genres: Comedy, Family, Romance. Overview: While trying to secure a $1 million donation for his museum, a befuddled paleontologist is pursued by a flighty and often irritating heiress and her pet leopard, Baby."
717,Bride of Frankenstein,"Drama, Horror, Sci-Fi","Mary Shelley reveals the main characters of her novel survived: Dr. Frankenstein, goaded by an even madder scientist, builds his monster a mate.","Title: Bride of Frankenstein. Genres: Drama, Horror, Sci-Fi. Overview: Mary Shelley reveals the main characters of her novel survived: Dr. Frankenstein, goaded by an even madder scientist, builds his monster a mate."
718,Duck Soup,"Comedy, Musical, War",Rufus T. Firefly is named president/dictator of bankrupt Freedonia and declares war on neighboring Sylvania over the love of wealthy Mrs. Teasdale.,"Title: Duck Soup. Genres: Comedy, Musical, War. Overview: Rufus T. Firefly is named president/dictator of bankrupt Freedonia and declares war on neighboring Sylvania over the love of wealthy Mrs. Teasdale."
719,Scarface: The Shame of the Nation,"Action, Crime, Drama","An ambitious and nearly insane violent gangster climbs the ladder of success in the mob, but his weaknesses prove to be his downfall.","Title: Scarface: The Shame of the Nation. Genres: Action, Crime, Drama. Overview: An ambitious and nearly insane violent gangster climbs the ladder of success in the mob, but his weaknesses prove to be his downfall."
720,Frankenstein,"Drama, Horror, Sci-Fi",Dr. Frankenstein dares to tamper with life and death by creating a human monster out of lifeless body parts.,"Title: Frankenstein. Genres: Drama, Horror, Sci-Fi. Overview: Dr. Frankenstein dares to tamper with life and death by creating a human monster out of lifeless body parts."
721,Roma,Drama,A year in the life of a middle-class family's maid in Mexico City in the early 1970s.,Title: Roma. Genres: Drama. Overview: A year in the life of a middle-class family's maid in Mexico City in the early 1970s.
722,God's Own Country,"Drama, Romance","Spring. Yorkshire. Young farmer Johnny Saxby numbs his daily frustrations with binge drinking and casual sex, until the arrival of a Romanian migrant worker for lambing season ignites an intense relationship that sets Johnny on a new path.","Title: God's Own Country. Genres: Drama, Romance. Overview: Spring. Yorkshire. Young farmer Johnny Saxby numbs his daily frustrations with binge drinking and casual sex, until the arrival of a Romanian migrant worker for lambing season ignites an intense relationship that sets Johnny on a new path."
723,Deadpool 2,"Action, Adventure, Comedy","Foul-mouthed mutant mercenary Wade Wilson (a.k.a. Deadpool), brings together a team of fellow mutant rogues to protect a young boy with supernatural abilities from the brutal, time-traveling cyborg Cable.","Title: Deadpool 2. Genres: Action, Adventure, Comedy. Overview: Foul-mouthed mutant mercenary Wade Wilson (a.k.a. Deadpool), brings together a team of fellow mutant rogues to protect a young boy with supernatural abilities from the brutal, time-traveling cyborg Cable."
724,Wind River,"Crime, Drama, Mystery",A veteran hunter helps an FBI agent investigate the murder of a young woman on a Wyoming Native American reservation.,"Title: Wind River. Genres: Crime, Drama, Mystery. Overview: A veteran hunter helps an FBI agent investigate the murder of a young woman on a Wyoming Native American reservation."
725,Get Out,"Horror, Mystery, Thriller","A young African-American visits his white girlfriend's parents for the weekend, where his simmering uneasiness about their reception of him eventually reaches a boiling point.","Title: Get Out. Genres: Horror, Mystery, Thriller. Overview: A young African-American visits his white girlfriend's parents for the weekend, where his simmering uneasiness about their reception of him eventually reaches a boiling point."
726,Mission: Impossible - Fallout,"Action, Adventure, Thriller","Ethan Hunt and his IMF team, along with some familiar allies, race against time after a mission gone wrong.","Title: Mission: Impossible - Fallout. Genres: Action, Adventure, Thriller. Overview: Ethan Hunt and his IMF team, along with some familiar allies, race against time after a mission gone wrong."
727,En man som heter Ove,"Comedy, Drama, Romance","Ove, an ill-tempered, isolated retiree who spends his days enforcing block association rules and visiting his wife's grave, has finally given up on life just as an unlikely friendship develops with his boisterous new neighbors.","Title: En man som heter Ove. Genres: Comedy, Drama, Romance. Overview: Ove, an ill-tempered, isolated retiree who spends his days enforcing block association rules and visiting his wife's grave, has finally given up on life just as an unlikely friendship develops with his boisterous new neighbors."
728,What We Do in the Shadows,"Comedy, Horror","Viago, Deacon and Vladislav are vampires who are finding that modern life has them struggling with the mundane - like paying rent, keeping up with the chore wheel, trying to get into nightclubs and overcoming flatmate conflicts.","Title: What We Do in the Shadows. Genres: Comedy, Horror. Overview: Viago, Deacon and Vladislav are vampires who are finding that modern life has them struggling with the mundane - like paying rent, keeping up with the chore wheel, trying to get into nightclubs and overcoming flatmate conflicts."
729,Omoide no Mânî,"Animation, Drama, Family","Due to 12 y.o. Anna's asthma, she's sent to stay with relatives of her guardian in the Japanese countryside. She likes to be alone, sketching. She befriends Marnie. Who is the mysterious, blonde Marnie.","Title: Omoide no Mânî. Genres: Animation, Drama, Family. Overview: Due to 12 y.o. Anna's asthma, she's sent to stay with relatives of her guardian in the Japanese countryside. She likes to be alone, sketching. She befriends Marnie. Who is the mysterious, blonde Marnie."
730,The Theory of Everything,"Biography, Drama, Romance",A look at the relationship between the famous physicist Stephen Hawking and his wife.,"Title: The Theory of Everything. Genres: Biography, Drama, Romance. Overview: A look at the relationship between the famous physicist Stephen Hawking and his wife."
731,Kingsman: The Secret Service,"Action, Adventure, Comedy","A spy organisation recruits a promising street kid into the agency's training program, while a global threat emerges from a twisted tech genius.","Title: Kingsman: The Secret Service. Genres: Action, Adventure, Comedy. Overview: A spy organisation recruits a promising street kid into the agency's training program, while a global threat emerges from a twisted tech genius."
732,The Fault in Our Stars,"Drama, Romance",Two teenage cancer patients begin a life-affirming journey to visit a reclusive author in Amsterdam.,"Title: The Fault in Our Stars. Genres: Drama, Romance. Overview: Two teenage cancer patients begin a life-affirming journey to visit a reclusive author in Amsterdam."
733,Me and Earl and the Dying Girl,"Comedy, Drama","High schooler Greg, who spends most of his time making parodies of classic movies with his co-worker Earl, finds his outlook forever altered after befriending a classmate who has just been diagnosed with cancer.","Title: Me and Earl and the Dying Girl. Genres: Comedy, Drama. Overview: High schooler Greg, who spends most of his time making parodies of classic movies with his co-worker Earl, finds his outlook forever altered after befriending a classmate who has just been diagnosed with cancer."
734,Birdman or (The Unexpected Virtue of Ignorance),"Comedy, Drama","A washed-up superhero actor attempts to revive his fading career by writing, directing, and starring in a Broadway production.","Title: Birdman or (The Unexpected Virtue of Ignorance). Genres: Comedy, Drama. Overview: A washed-up superhero actor attempts to revive his fading career by writing, directing, and starring in a Broadway production."
735,La vie d'Adèle,"Drama, Romance","Adèle's life is changed when she meets Emma, a young woman with blue hair, who will allow her to discover desire and to assert herself as a woman and as an adult. In front of others, Adèle grows, seeks herself, loses herself, and ultimately finds herself through love and loss.","Title: La vie d'Adèle. Genres: Drama, Romance. Overview: Adèle's life is changed when she meets Emma, a young woman with blue hair, who will allow her to discover desire and to assert herself as a woman and as an adult. In front of others, Adèle grows, seeks herself, loses herself, and ultimately finds herself through love and loss."
736,Kai po che!,"Drama, Sport",Three friends growing up in India at the turn of the millennium set out to open a training academy to produce the country's next cricket stars.,"Title: Kai po che!. Genres: Drama, Sport. Overview: Three friends growing up in India at the turn of the millennium set out to open a training academy to produce the country's next cricket stars."
737,The Broken Circle Breakdown,"Drama, Music, Romance","Elise and Didier fall in love at first sight, in spite of their differences. He talks, she listens. He's a romantic atheist, she's a religious realist. When their daughter becomes seriously ill, their love is put on trial.","Title: The Broken Circle Breakdown. Genres: Drama, Music, Romance. Overview: Elise and Didier fall in love at first sight, in spite of their differences. He talks, she listens. He's a romantic atheist, she's a religious realist. When their daughter becomes seriously ill, their love is put on trial."
738,Captain America: The Winter Soldier,"Action, Adventure, Sci-Fi","As Steve Rogers struggles to embrace his role in the modern world, he teams up with a fellow Avenger and S.H.I.E.L.D agent, Black Widow, to battle a new threat from history: an assassin known as the Winter Soldier.","Title: Captain America: The Winter Soldier. Genres: Action, Adventure, Sci-Fi. Overview: As Steve Rogers struggles to embrace his role in the modern world, he teams up with a fellow Avenger and S.H.I.E.L.D agent, Black Widow, to battle a new threat from history: an assassin known as the Winter Soldier."
739,Rockstar,"Drama, Music, Musical","Janardhan Jakhar chases his dreams of becoming a big Rock star, during which he falls in love with Heer.","Title: Rockstar. Genres: Drama, Music, Musical. Overview: Janardhan Jakhar chases his dreams of becoming a big Rock star, during which he falls in love with Heer."
740,Nebraska,"Adventure, Comedy, Drama","An aging, booze-addled father makes the trip from Montana to Nebraska with his estranged son in order to claim a million-dollar Mega Sweepstakes Marketing prize.","Title: Nebraska. Genres: Adventure, Comedy, Drama. Overview: An aging, booze-addled father makes the trip from Montana to Nebraska with his estranged son in order to claim a million-dollar Mega Sweepstakes Marketing prize."
741,Wreck-It Ralph,"Animation, Adventure, Comedy","A video game villain wants to be a hero and sets out to fulfill his dream, but his quest brings havoc to the whole arcade where he lives.","Title: Wreck-It Ralph. Genres: Animation, Adventure, Comedy. Overview: A video game villain wants to be a hero and sets out to fulfill his dream, but his quest brings havoc to the whole arcade where he lives."
742,Le Petit Prince,"Animation, Adventure, Drama","A little girl lives in a very grown-up world with her mother, who tries to prepare her for it. Her neighbor, the Aviator, introduces the girl to an extraordinary world where anything is possible, the world of the Little Prince.","Title: Le Petit Prince. Genres: Animation, Adventure, Drama. Overview: A little girl lives in a very grown-up world with her mother, who tries to prepare her for it. Her neighbor, the Aviator, introduces the girl to an extraordinary world where anything is possible, the world of the Little Prince."
743,Detachment,Drama,A substitute teacher who drifts from classroom to classroom finds a connection to the students and teachers during his latest assignment.,Title: Detachment. Genres: Drama. Overview: A substitute teacher who drifts from classroom to classroom finds a connection to the students and teachers during his latest assignment.
744,Midnight in Paris,"Comedy, Fantasy, Romance","While on a trip to Paris with his fiancée's family, a nostalgic screenwriter finds himself mysteriously going back to the 1920s every day at midnight.","Title: Midnight in Paris. Genres: Comedy, Fantasy, Romance. Overview: While on a trip to Paris with his fiancée's family, a nostalgic screenwriter finds himself mysteriously going back to the 1920s every day at midnight."
745,The Lego Movie,"Animation, Action, Adventure","An ordinary LEGO construction worker, thought to be the prophesied as ""special"", is recruited to join a quest to stop an evil tyrant from gluing the LEGO universe into eternal stasis.","Title: The Lego Movie. Genres: Animation, Action, Adventure. Overview: An ordinary LEGO construction worker, thought to be the prophesied as ""special"", is recruited to join a quest to stop an evil tyrant from gluing the LEGO universe into eternal stasis."
746,Gravity,"Drama, Sci-Fi, Thriller",Two astronauts work together to survive after an accident leaves them stranded in space.,"Title: Gravity. Genres: Drama, Sci-Fi, Thriller. Overview: Two astronauts work together to survive after an accident leaves them stranded in space."
747,Star Trek Into Darkness,"Action, Adventure, Sci-Fi","After the crew of the Enterprise find an unstoppable force of terror from within their own organization, Captain Kirk leads a manhunt to a war-zone world to capture a one-man weapon of mass destruction.","Title: Star Trek Into Darkness. Genres: Action, Adventure, Sci-Fi. Overview: After the crew of the Enterprise find an unstoppable force of terror from within their own organization, Captain Kirk leads a manhunt to a war-zone world to capture a one-man weapon of mass destruction."
748,Beasts of No Nation,"Drama, War","A drama based on the experiences of Agu, a child soldier fighting in the civil war of an unnamed African country.","Title: Beasts of No Nation. Genres: Drama, War. Overview: A drama based on the experiences of Agu, a child soldier fighting in the civil war of an unnamed African country."
749,The Social Network,"Biography, Drama","As Harvard student Mark Zuckerberg creates the social networking site that would become known as Facebook, he is sued by the twins who claimed he stole their idea, and by the co-founder who was later squeezed out of the business.","Title: The Social Network. Genres: Biography, Drama. Overview: As Harvard student Mark Zuckerberg creates the social networking site that would become known as Facebook, he is sued by the twins who claimed he stole their idea, and by the co-founder who was later squeezed out of the business."
750,X: First Class,"Action, Adventure, Sci-Fi","In the 1960s, superpowered humans Charles Xavier and Erik Lensherr work together to find others like them, but Erik's vengeful pursuit of an ambitious mutant who ruined his life causes a schism to divide them.","Title: X: First Class. Genres: Action, Adventure, Sci-Fi. Overview: In the 1960s, superpowered humans Charles Xavier and Erik Lensherr work together to find others like them, but Erik's vengeful pursuit of an ambitious mutant who ruined his life causes a schism to divide them."
751,The Hangover,Comedy,"Three buddies wake up from a bachelor party in Las Vegas, with no memory of the previous night and the bachelor missing. They make their way around the city in order to find their friend before his wedding.","Title: The Hangover. Genres: Comedy. Overview: Three buddies wake up from a bachelor party in Las Vegas, with no memory of the previous night and the bachelor missing. They make their way around the city in order to find their friend before his wedding."
752,Skyfall,"Action, Adventure, Thriller","James Bond's loyalty to M is tested when her past comes back to haunt her. When MI6 comes under attack, 007 must track down and destroy the threat, no matter how personal the cost.","Title: Skyfall. Genres: Action, Adventure, Thriller. Overview: James Bond's loyalty to M is tested when her past comes back to haunt her. When MI6 comes under attack, 007 must track down and destroy the threat, no matter how personal the cost."
753,Silver Linings Playbook,"Comedy, Drama, Romance","After a stint in a mental institution, former teacher Pat Solitano moves back in with his parents and tries to reconcile with his ex-wife. Things get more challenging when Pat meets Tiffany, a mysterious girl with problems of her own.","Title: Silver Linings Playbook. Genres: Comedy, Drama, Romance. Overview: After a stint in a mental institution, former teacher Pat Solitano moves back in with his parents and tries to reconcile with his ex-wife. Things get more challenging when Pat meets Tiffany, a mysterious girl with problems of her own."
754,Argo,"Biography, Drama, Thriller","Acting under the cover of a Hollywood producer scouting a location for a science fiction film, a CIA agent launches a dangerous operation to rescue six Americans in Tehran during the U.S. hostage crisis in Iran in 1979.","Title: Argo. Genres: Biography, Drama, Thriller. Overview: Acting under the cover of a Hollywood producer scouting a location for a science fiction film, a CIA agent launches a dangerous operation to rescue six Americans in Tehran during the U.S. hostage crisis in Iran in 1979."
755,(500) Days of Summer,"Comedy, Drama, Romance","An offbeat romantic comedy about a woman who doesn't believe true love exists, and the young man who falls for her.","Title: (500) Days of Summer. Genres: Comedy, Drama, Romance. Overview: An offbeat romantic comedy about a woman who doesn't believe true love exists, and the young man who falls for her."
756,Harry Potter and the Deathly Hallows: Part 1,"Adventure, Family, Fantasy","As Harry, Ron, and Hermione race against time and evil to destroy the Horcruxes, they uncover the existence of the three most powerful objects in the wizarding world: the Deathly Hallows.","Title: Harry Potter and the Deathly Hallows: Part 1. Genres: Adventure, Family, Fantasy. Overview: As Harry, Ron, and Hermione race against time and evil to destroy the Horcruxes, they uncover the existence of the three most powerful objects in the wizarding world: the Deathly Hallows."
757,Gake no ue no Ponyo,"Animation, Adventure, Comedy","A five-year-old boy develops a relationship with Ponyo, a young goldfish princess who longs to become a human after falling in love with him.","Title: Gake no ue no Ponyo. Genres: Animation, Adventure, Comedy. Overview: A five-year-old boy develops a relationship with Ponyo, a young goldfish princess who longs to become a human after falling in love with him."
758,Frost/Nixon,"Biography, Drama, History",A dramatic retelling of the post-Watergate television interviews between British talk-show host David Frost and former president Richard Nixon.,"Title: Frost/Nixon. Genres: Biography, Drama, History. Overview: A dramatic retelling of the post-Watergate television interviews between British talk-show host David Frost and former president Richard Nixon."
759,Papurika,"Animation, Drama, Fantasy","When a machine that allows therapists to enter their patients' dreams is stolen, all Hell breaks loose. Only a young female therapist, Paprika, can stop it.","Title: Papurika. Genres: Animation, Drama, Fantasy. Overview: When a machine that allows therapists to enter their patients' dreams is stolen, all Hell breaks loose. Only a young female therapist, Paprika, can stop it."
760,Changeling,"Biography, Crime, Drama",Grief-stricken mother Christine Collins (Angelina Jolie) takes on the L.A.P.D. to her own detriment when it tries to pass off an obvious impostor as her missing child.,"Title: Changeling. Genres: Biography, Crime, Drama. Overview: Grief-stricken mother Christine Collins (Angelina Jolie) takes on the L.A.P.D. to her own detriment when it tries to pass off an obvious impostor as her missing child."
761,Flipped,"Comedy, Drama, Romance",Two eighth-graders start to have feelings for each other despite being total opposites.,"Title: Flipped. Genres: Comedy, Drama, Romance. Overview: Two eighth-graders start to have feelings for each other despite being total opposites."
